{
  "question_id": "Q07",
  "case_id": "SF-010",
  "source_public_manifest_sha256": "6598702cfb9edd0cd5476de44e46c5c75191f12583c67c34c86e75a6e8d47a96",
  "source_file_sha256": "b6c5a28889a542d6785de4fb5dc391087a22f854189790963805e123b5299393",
  "canonical_chart_data": [
    {
      "series": "frontend-proxy",
      "timestamp_utc": "2026-10-15T16:37:43.727538+00:00",
      "minute_index": 0,
      "value": 25.821,
      "sample_count": 1229
    },
    {
      "series": "frontend-proxy",
      "timestamp_utc": "2026-10-15T16:38:43.727538+00:00",
      "minute_index": 1,
      "value": 27.229,
      "sample_count": 1370
    },
    {
      "series": "frontend-proxy",
      "timestamp_utc": "2026-10-15T16:39:43.727538+00:00",
      "minute_index": 2,
      "value": 27.141,
      "sample_count": 1226
    },
    {
      "series": "frontend-proxy",
      "timestamp_utc": "2026-10-15T16:40:43.727538+00:00",
      "minute_index": 3,
      "value": 28.33,
      "sample_count": 1232
    },
    {
      "series": "frontend-proxy",
      "timestamp_utc": "2026-10-15T16:41:43.727538+00:00",
      "minute_index": 4,
      "value": 26.217,
      "sample_count": 1173
    },
    {
      "series": "frontend-proxy",
      "timestamp_utc": "2026-10-15T16:42:43.727538+00:00",
      "minute_index": 5,
      "value": 27.574,
      "sample_count": 1263
    },
    {
      "series": "frontend-proxy",
      "timestamp_utc": "2026-10-15T16:43:43.727538+00:00",
      "minute_index": 6,
      "value": 26.339,
      "sample_count": 1139
    },
    {
      "series": "frontend-proxy",
      "timestamp_utc": "2026-10-15T16:44:43.727538+00:00",
      "minute_index": 7,
      "value": 25.876,
      "sample_count": 1119
    },
    {
      "series": "frontend-proxy",
      "timestamp_utc": "2026-10-15T16:45:43.727538+00:00",
      "minute_index": 8,
      "value": 29.091,
      "sample_count": 1162
    },
    {
      "series": "frontend-proxy",
      "timestamp_utc": "2026-10-15T16:46:43.727538+00:00",
      "minute_index": 9,
      "value": 26.623,
      "sample_count": 1229
    },
    {
      "series": "frontend-proxy",
      "timestamp_utc": "2026-10-15T16:47:43.727538+00:00",
      "minute_index": 10,
      "value": 37.398,
      "sample_count": 975
    },
    {
      "series": "frontend-proxy",
      "timestamp_utc": "2026-10-15T16:48:43.727538+00:00",
      "minute_index": 11,
      "value": 30.311,
      "sample_count": 1312
    },
    {
      "series": "frontend-proxy",
      "timestamp_utc": "2026-10-15T16:49:43.727538+00:00",
      "minute_index": 12,
      "value": 29.076,
      "sample_count": 1226
    },
    {
      "series": "frontend-proxy",
      "timestamp_utc": "2026-10-15T16:50:43.727538+00:00",
      "minute_index": 13,
      "value": 28.032,
      "sample_count": 1169
    },
    {
      "series": "frontend-proxy",
      "timestamp_utc": "2026-10-15T16:51:43.727538+00:00",
      "minute_index": 14,
      "value": 27.604,
      "sample_count": 1171
    },
    {
      "series": "frontend-proxy",
      "timestamp_utc": "2026-10-15T16:52:43.727538+00:00",
      "minute_index": 15,
      "value": 27.434,
      "sample_count": 1227
    },
    {
      "series": "frontend-proxy",
      "timestamp_utc": "2026-10-15T16:53:43.727538+00:00",
      "minute_index": 16,
      "value": 256.988,
      "sample_count": 1178
    },
    {
      "series": "frontend-proxy",
      "timestamp_utc": "2026-10-15T16:54:43.727538+00:00",
      "minute_index": 17,
      "value": 29.805,
      "sample_count": 1191
    },
    {
      "series": "frontend-proxy",
      "timestamp_utc": "2026-10-15T16:55:43.727538+00:00",
      "minute_index": 18,
      "value": 29.573,
      "sample_count": 1259
    },
    {
      "series": "frontend-proxy",
      "timestamp_utc": "2026-10-15T16:56:43.727538+00:00",
      "minute_index": 19,
      "value": 31.1,
      "sample_count": 1231
    },
    {
      "series": "frontend-proxy",
      "timestamp_utc": "2026-10-15T16:57:43.727538+00:00",
      "minute_index": 20,
      "value": 28.409,
      "sample_count": 1232
    },
    {
      "series": "frontend-proxy",
      "timestamp_utc": "2026-10-15T16:58:43.727538+00:00",
      "minute_index": 21,
      "value": 29.541,
      "sample_count": 1186
    },
    {
      "series": "frontend-proxy",
      "timestamp_utc": "2026-10-15T16:59:43.727538+00:00",
      "minute_index": 22,
      "value": 30.207,
      "sample_count": 1250
    },
    {
      "series": "frontend-proxy",
      "timestamp_utc": "2026-10-15T17:00:43.727538+00:00",
      "minute_index": 23,
      "value": 27.761,
      "sample_count": 1198
    },
    {
      "series": "frontend-proxy",
      "timestamp_utc": "2026-10-15T17:01:43.727538+00:00",
      "minute_index": 24,
      "value": 26.48,
      "sample_count": 1363
    },
    {
      "series": "frontend-proxy",
      "timestamp_utc": "2026-10-15T17:02:43.727538+00:00",
      "minute_index": 25,
      "value": 29.759,
      "sample_count": 1245
    },
    {
      "series": "frontend-proxy",
      "timestamp_utc": "2026-10-15T17:03:43.727538+00:00",
      "minute_index": 26,
      "value": 29.028,
      "sample_count": 1228
    },
    {
      "series": "frontend-proxy",
      "timestamp_utc": "2026-10-15T17:04:43.727538+00:00",
      "minute_index": 27,
      "value": 30.214,
      "sample_count": 1245
    },
    {
      "series": "frontend-proxy",
      "timestamp_utc": "2026-10-15T17:05:43.727538+00:00",
      "minute_index": 28,
      "value": 30.002,
      "sample_count": 1138
    },
    {
      "series": "frontend-proxy",
      "timestamp_utc": "2026-10-15T17:06:43.727538+00:00",
      "minute_index": 29,
      "value": 30.298,
      "sample_count": 1247
    }
  ],
  "reference_chart_path": "private/reference-charts/Q07.png",
  "three_gold_answers": [
    {
      "answer_type": "number",
      "answer": 256.99,
      "answer_unit": "ms",
      "numerical_tolerance": 0.02,
      "time_tolerance_seconds": 0,
      "calculation_method": "max of minute nearest-rank p95 values"
    },
    {
      "answer_type": "time",
      "answer": "2026-10-15T16:53:43.727538+00:00",
      "answer_unit": "UTC",
      "numerical_tolerance": null,
      "time_tolerance_seconds": 0,
      "calculation_method": "earliest maximum minute start"
    },
    {
      "answer_type": "number",
      "answer": 48.03,
      "answer_unit": "ms",
      "numerical_tolerance": 0.02,
      "time_tolerance_seconds": 0,
      "calculation_method": "unweighted mean of five p95 values: second window minus first"
    }
  ],
  "supporting_public_records": [
    {
      "timestamp_utc": "2026-10-15T16:39:30.857369+00:00",
      "trace_id": "262ac972740794e106fd985e8c24c52b",
      "span_id": "a862f840e07f87ec",
      "service": "frontend-proxy",
      "parent_service": null,
      "duration_ms": 25.555,
      "status": null
    },
    {
      "timestamp_utc": "2026-10-15T16:39:31.192867+00:00",
      "trace_id": "5c9059555cdbabbdd88f13dd6eeb6799",
      "span_id": "0a3597beb747b6e6",
      "service": "frontend-proxy",
      "parent_service": null,
      "duration_ms": 7.172,
      "status": null
    },
    {
      "timestamp_utc": "2026-10-15T16:39:32.165375+00:00",
      "trace_id": "b42ebf0ad6f73b5b1b3cc97cbcf7d1c3",
      "span_id": "a634abcf43119eed",
      "service": "frontend-proxy",
      "parent_service": null,
      "duration_ms": 6.427,
      "status": null
    },
    {
      "timestamp_utc": "2026-10-15T16:39:32.285574+00:00",
      "trace_id": "a020f4c1bfaa88e2742ee27b3e19c168",
      "span_id": "d69f7b5453b1a50f",
      "service": "frontend-proxy",
      "parent_service": null,
      "duration_ms": 22.433,
      "status": null
    },
    {
      "timestamp_utc": "2026-10-15T16:39:32.503580+00:00",
      "trace_id": "5617c5c3abe2ea01869ed99a2e516492",
      "span_id": "344db12ec1974fe1",
      "service": "frontend-proxy",
      "parent_service": "frontend-web",
      "duration_ms": 1.424,
      "status": null
    },
    {
      "timestamp_utc": "2026-10-15T16:39:32.167090+00:00",
      "trace_id": "37fab6b0db08e25177942ac8d77e5b79",
      "span_id": "52709a1ec8285c01",
      "service": "frontend-proxy",
      "parent_service": null,
      "duration_ms": 1.483,
      "status": null
    }
  ],
  "grading_rubric": {
    "chart_points": 4,
    "answer_points_each": 2,
    "chart_breakdown": {
      "entity_and_filter": 1,
      "time_axis": 1,
      "values_and_aggregation": 1,
      "unit_and_legend": 1
    }
  },
  "gt_version": "semifinal-query-visualization-candidate-v1",
  "review_status": "DRAFT_PENDING_HUMAN_REVIEW",
  "calculation_method": {
    "source_file": "traces.parquet",
    "source_columns": [
      "start_time",
      "service",
      "parent_service",
      "operation_name",
      "duration_ms",
      "status",
      "attributes"
    ],
    "filters": {
      "entities": [
        "frontend-proxy"
      ],
      "span_kind": "server",
      "operation_name": "ingress"
    },
    "aggregation": "nearest-rank p95 of valid duration_ms in each bucket",
    "time_bucket": {
      "origin_utc": "2026-10-15T16:37:43.727538+00:00",
      "width_seconds": 60,
      "closed": "left",
      "timestamp_label": "bucket start UTC",
      "observation_end_exclusive_utc": "2026-10-15T17:07:43.727538+00:00"
    },
    "minimum_samples_per_minute": 20,
    "missing_policy": "null and line gap for insufficient samples; zero only for observed count queries",
    "counter_reset_policy": "not applicable",
    "p95_definition": "sort ascending; rank ceil(0.95*n), one-based",
    "comparison_minute_ranges": [
      [
        0,
        5
      ],
      [
        15,
        20
      ]
    ]
  }
}
